Approvato,Descrizione,Comune,Indirizzo,Data,Ora,Fonte,Link,Note,Id,Chiuso
,Si richiede AIUTO PSICOLOGICO esperto e supporto generico,Amatrice,Villa San Cipriano,26/08/2016,10:01,Volontari VVFF di Amatrice (contatto Sara Vegni),,,201608261001,
,Si richiede supporto generico ,Amatrice,Ristorante Giovannino,26/08/2016,10:00,Volontari VVFF di Amatrice (contatto Sara Vegni),,,201608261000,
,Si richiede supporto per campo autogestito ,Amatrice,Capricchia,25/08/2016,20:00,Comitato 3e32 ,,,201608252000,
,Elenco salme identificate,Rieti,Rieti,26/08/2016,16:40,Prefettura di Rieti,http://www.prefettura.it/rieti/allegati/3274078.htm,,201608261640,
,Elenco vittime aggiornato al 26/06/16,Ascoli Piceno,Ascoli Piceno,26/08/2016,11:30,Prefettura di Ascoli Piceno,http://www.prefettura.it/ascolipiceno/news/46288.htm#News_61177,,201608261130,
,Riaperto Svincolo per Retrosi,Amatrice,,28/08/2016,10:00,,,,201608281000,
